Token	Corpus	Time	Text	Genre	Type	Whole_Genitive	Possessor	Possessum	Possessor_Length	Possessum_Length
bn02.0108.02	Brown	1960	N02	Adventure Fiction	of	the steps of the saloon	the saloon	the steps	2	2
bn02.0113.02	Brown	1960	N02	Adventure Fiction	of	the hollow of his cheek	his cheek	the hollow	2	2
bn02.0121.02	Brown	1960	N02	Adventure Fiction	of	the far end of the valley	the valley	the far end	2	3
bn02.0127.01	Brown	1960	N02	Adventure Fiction	s	Clayton's mocking smile	Clayton's	mocking smile	1	2
bn02.0141.01	Brown	1960	N02	Adventure Fiction	of	the cloying warmth of the saloon	the saloon	the cloying warmth	2	3
bn02.0141.02	Brown	1960	N02	Adventure Fiction	of	the cold of the ebbing night	the ebbing night	the cold	3	2
bn02.0142.01	Brown	1960	N02	Adventure Fiction	of	the sleeve of his jacket	his jacket	the sleeve	2	2
bn02.0146.03	Brown	1960	N02	Adventure Fiction	of	the shadows of the running horses	the running horses	the shadows	3	2
bn02.0149.02	Brown	1960	N02	Adventure Fiction	of	the hoofs of Gavin's stallion	Gavin's stallion	the hoofs	2	2
bn02.0155.01	Brown	1960	N02	Adventure Fiction	of	the staccato beat of hoofs	hoofs	the staccato beat	1	3
bn02.0160.01	Brown	1960	N02	Adventure Fiction	of	every leaping stride of the horse beneath him	the horse beneath him	every leaping stride	4	3
bn03.0025.01	Brown	1960	N03	Adventure Fiction	of	the sake of Julia and Susan	Julia and Susan	the sake	3	2
bn03.0065.01	Brown	1960	N03	Adventure Fiction	of	the rear wall of the stockade	the stockade	the rear wall	2	3
bn03.0075.01	Brown	1960	N03	Adventure Fiction	of	the shadow of the stockade wall	the stockade wall	the shadow	3	2
bn03.0077.01	Brown	1960	N03	Adventure Fiction	of	the muzzle of the pistol	the pistol	the muzzle	2	2
bn03.0085.01	Brown	1960	N03	Adventure Fiction	of	The explosion of the rifle	the rifle	The explosion	2	2
bn03.0085.02	Brown	1960	N03	Adventure Fiction	of	the walls of the stockade	the stockade	the walls	2	2
bn03.0094.01	Brown	1960	N03	Adventure Fiction	s	The sentry's saddled horse	The sentry's	saddled horse	2	2
bn03.0099.01	Brown	1960	N03	Adventure Fiction	s	Mike's attempt to push him toward the horse	Mike's	attempt to push him toward the horse	1	7
bn03.0126.02	Brown	1960	N03	Adventure Fiction	of	the west end of the enclosure	the enclosure	the west end	2	3
bn03.0130.01	Brown	1960	N03	Adventure Fiction	of	the east wall of the stockade	the stockade	the east wall	2	3
bn03.0130.02	Brown	1960	N03	Adventure Fiction	of	the rear of the two frame buildings	the two frame buildings	the rear	4	2
bn03.0133.01	Brown	1960	N03	Adventure Fiction	of	the wake of the departing horses	the departing horses	the wake	3	2
bn03.0140.01	Brown	1960	N03	Adventure Fiction	of	the rear of the frame buildings	the frame buildings	the rear	3	2
bn03.0143.01	Brown	1960	N03	Adventure Fiction	of	the open door of the lighted orderly room	the lighted orderly room	the open door	4	3
bn03.0143.04	Brown	1960	N03	Adventure Fiction	of	the east end of the stockade	the stockade	the east end	2	3
bn03.0153.01	Brown	1960	N03	Adventure Fiction	of	the looming hoods of the supply wagons	the supply wagons	the looming hoods	3	3
bn03.0157.01	Brown	1960	N03	Adventure Fiction	of	the contents of the canister	the canister	the contents	2	2
bn03.0164.01	Brown	1960	N03	Adventure Fiction	of	the muzzle of one of the rifles that projected from the shoulder pack	one of the rifles that projected from the shoulder pack	the muzzle	8	2
bn03.0200.01	Brown	1960	N03	Adventure Fiction	of	The roof of the command post	the command post	The roof	3	2
bn03.0200.01	Brown	1960	N03	Adventure Fiction	of	The roof of the command post	the command post	The roof	3	2
bn03.0200.01	Brown	1960	N03	Adventure Fiction	of	The roof of the command post	the command post	The roof	3	2
bn04.0011.01	Brown	1960	N04	Adventure Fiction	of	the center of the camp	the camp	the center	2	2
bn04.0029.01	Brown	1960	N04	Adventure Fiction	of	the ears of the Sioux	the Sioux	the ears	2	2
bn04.0050.03	Brown	1960	N04	Adventure Fiction	s	Old Knife's large party of screeching warriors	Old Knife's	large party of screeching warriors	2	5
bn04.0052.03	Brown	1960	N04	Adventure Fiction	of	the endless wars of the plains	the plains	the endless wars	2	3
bn04.0064.02	Brown	1960	N04	Adventure Fiction	of	the center of a wide valley	a wide valley	the center	3	2
bn04.0071.01	Brown	1960	N04	Adventure Fiction	of	the sounds of the industrious insects	the industrious insects	the sounds	3	2
bn04.0072.01	Brown	1960	N04	Adventure Fiction	of	the whinny of a restless pony	a restless pony	the whinny	3	2
bn04.0078.01	Brown	1960	N04	Adventure Fiction	of	the barrel of his rifle	his rifle	the barrel	2	2
bn04.0090.03	Brown	1960	N04	Adventure Fiction	of	the strain of his screams	his screams	the strain	2	2
bn04.0101.02	Brown	1960	N04	Adventure Fiction	of	the chest of his pony	his pony	the chest	2	2
bn04.0108.01	Brown	1960	N04	Adventure Fiction	of	the rattle of gunfire	gunfire	the rattle	1	2
bn04.0116.01	Brown	1960	N04	Adventure Fiction	of	the sweetish odor of new-spilled blood	new-spilled blood	the sweetish odor	2	3
bn04.0116.02	Brown	1960	N04	Adventure Fiction	of	the acrid stench of frightened horses	frightened horses	the acrid stench	2	3
bn04.0116.03	Brown	1960	N04	Adventure Fiction	of	the bitterness of burned powder	burned powder	the bitterness	2	2
bn04.0127.01	Brown	1960	N04	Adventure Fiction	of	the end of the valley	the valley	the end	2	2
bn04.0143.01	Brown	1960	N04	Adventure Fiction	of	the whir of an ax	an ax	the whir	2	2
bn04.0145.02	Brown	1960	N04	Adventure Fiction	of	the top of the bale	the bale	the top	2	2
bn04.0150.01	Brown	1960	N04	Adventure Fiction	of	the twitching body of the man he had shot	the man he had shot	the twitching body	5	3
bn04.0163.04	Brown	1960	N04	Adventure Fiction	of	the relentless slam , slam of the cruelly efficient Hawkinses	the cruelly efficient Hawkinses	the relentless slam , slam	4	5
bn04.0165.01	Brown	1960	N04	Adventure Fiction	of	the backs of their wounded , screaming mounts	their wounded, screaming mounts	the backs	4	2
bn04.0165.01	Brown	1960	N04	Adventure Fiction	of	the backs of their wounded , screaming mounts	their wounded, screaming mounts	the backs	4	2
bn05.0028.03	Brown	1960	N05	Adventure Fiction	of	the far reaches of the firelight	the firelight	the far reaches	2	3
bn05.0098.01	Brown	1960	N05	Adventure Fiction	of	the corner of his mouth	his mouth	the corner	2	2
bn05.0117.01	Brown	1960	N05	Adventure Fiction	of	the sleeve of her coat	her coat	the sleeve	2	2
bn05.0119.02	Brown	1960	N05	Adventure Fiction	of	the handle of the quirt	the quirt	the handle	2	2
bn05.0135.01	Brown	1960	N05	Adventure Fiction	of	the sound of her horse	her horse	the sound	2	2
bn05.0183.01	Brown	1960	N05	Adventure Fiction	of	The first part of the road	the road	The first part	2	3
bn05.0186.01	Brown	1960	N05	Adventure Fiction	of	the side of the road	the road	the side	2	2
bn05.0187.01	Brown	1960	N05	Adventure Fiction	of	the first houses of Kelseyville	Kelseyville	the first houses	1	3
bn06.0001.02	Brown	1960	N06	Adventure Fiction	of	my state of mind	mind	my state	1	2
bn06.0010.01	Brown	1960	N06	Adventure Fiction	of	The pulsing glow of a cigarette	a cigarette	The pulsing glow	2	3
bn06.0016.02	Brown	1960	N06	Adventure Fiction	of	the far edge of the counter	the counter	the far edge	2	3
bn06.0025.02	Brown	1960	N06	Adventure Fiction	of	the cause of his baldness	his baldness	the cause	2	2
bn06.0038.02	Brown	1960	N06	Adventure Fiction	of	the far end of the hall	the hall	the far end	2	3
bn06.0045.01	Brown	1960	N06	Adventure Fiction	of	the worth of a ticket	a ticket	the worth	2	2
bn06.0048.01	Brown	1960	N06	Adventure Fiction	of	The presence of the two exhaust fans	the two exhaust fans	The presence	4	2
bn06.0072.01	Brown	1960	N06	Adventure Fiction	of	the neighborhood of the hall	the hall	the neighborhood	2	2
bn06.0076.01	Brown	1960	N06	Adventure Fiction	of	the tops of ships' masts and funnels	ships' masts and funnels	the tops	4	2
bn06.0076.02	Brown	1960	N06	Adventure Fiction	s	ships' masts and funnels	ships'	masts and funnels	1	3
bn06.0081.01	Brown	1960	N06	Adventure Fiction	of	the rear of the hall	the hall	the rear	2	2
bn06.0083.02	Brown	1960	N06	Adventure Fiction	s	longshoremen's lunch counters	longshoremen's	lunch counters	1	2
bn06.0085.02	Brown	1960	N06	Adventure Fiction	of	the process of my application	my application	the process	2	2
bn06.0088.01	Brown	1960	N06	Adventure Fiction	of	the director of the hall	the hall	the director	2	2
bn06.0094.01	Brown	1960	N06	Adventure Fiction	of	the remnants of stale smoke	stale smoke	the remnants	2	2
bn06.0096.01	Brown	1960	N06	Adventure Fiction	of	the heavy footfalls of many men	many men	the heavy footfalls	2	3
bn06.0098.01	Brown	1960	N06	Adventure Fiction	of	the rear wall of the office	the office	the rear wall	2	3
bn06.0109.02	Brown	1960	N06	Adventure Fiction	of	the workings of the hall	the hall	the workings	2	2
bn07.0001.01	Brown	1960	N07	Adventure Fiction	of	the back of his head	his head	the back	2	2
bn07.0004.02	Brown	1960	N07	Adventure Fiction	s	the guard's own gun	the guard's	own gun	2	2
bn07.0040.01	Brown	1960	N07	Adventure Fiction	of	the cord of the alarm bell	the alarm bell	the cord	3	2
bn07.0042.03	Brown	1960	N07	Adventure Fiction	of	the barrel of his gun	his gun	the barrel	2	2
bn07.0052.01	Brown	1960	N07	Adventure Fiction	of	the uniform of prison guards	prison guards	the uniform	2	2
bn07.0052.02	Brown	1960	N07	Adventure Fiction	of	the striped suits of convicts	convicts	the striped suits	1	3
bn07.0054.01	Brown	1960	N07	Adventure Fiction	of	the protection of the trees	the trees	the protection	2	2
bn07.0058.01	Brown	1960	N07	Adventure Fiction	s	Dill's release from the prison	Dill's	release from the prison	1	4
bn07.0086.02	Brown	1960	N07	Adventure Fiction	of	the solace of tobacco	tobacco	the solace	1	2
bn07.0151.02	Brown	1960	N07	Adventure Fiction	of	the central portion of the state	the state	the central portion	2	3
bn07.0161.01	Brown	1960	N07	Adventure Fiction	of	the onslaught of the powerful streams	the powerful streams	the onslaught	3	2
bn07.0161.02	Brown	1960	N07	Adventure Fiction	of	the force of a thousand fire hoses	a thousand fire hoses	the force	4	2
bn07.0165.02	Brown	1960	N07	Adventure Fiction	of	the swelling volume of a hundred tornadoes	a hundred tornadoes	the swelling volume	3	3
bn07.0176.03	Brown	1960	N07	Adventure Fiction	of	the fixed intensity of a cobra	a cobra	the fixed intensity	2	3
bn07.0185.01	Brown	1960	N07	Adventure Fiction	of	the top drawer of his desk	his desk	the top drawer	2	3
bn07.0197.01	Brown	1960	N07	Adventure Fiction	s	Barton's Night Riders	Barton's	Night Riders	1	2
bn08.0001.01	Brown	1960	N08	Adventure Fiction	of	the part of her mother	her mother	the part	2	2
bn08.0003.02	Brown	1960	N08	Adventure Fiction	of	the care of the little pink woman who chose to be called Auntie	the little pink woman who chose to be called Auntie	the care	8	2
bn08.0011.01	Brown	1960	N08	Adventure Fiction	of	the porch of the Culver house	the Culver house	the porch	3	2
bn08.0012.03	Brown	1960	N08	Adventure Fiction	of	the stealth of a criminal who has plotted his felony for months in advance and knows exactly which step to take next in the course of the final execution of his crime	a criminal who has plotted his felony for months in advance and knows exactly which step to take next in the course of the final execution of his crime	the stealth	8	2
bn08.0012.05	Brown	1960	N08	Adventure Fiction	of	the course of the final execution of his crime	the final execution of his crime	the course	6	2
bn08.0012.06	Brown	1960	N08	Adventure Fiction	of	the final execution of his crime	his crime	the final execution	2	3
bn08.0015.03	Brown	1960	N08	Adventure Fiction	of	the property of her great-grandfather , Major Hiram Munroe Culver	her great-grandfather, Major Hiram Munroe Culver	the property	6	2
bn08.0019.01	Brown	1960	N08	Adventure Fiction	of	the pocket of her slacks	her slacks	the pocket	2	2
bn08.0026.01	Brown	1960	N08	Adventure Fiction	of	the direction of the pool	the pool	the direction	2	2
bn08.0036.01	Brown	1960	N08	Adventure Fiction	of	the motion of her heart	her heart	the motion	2	2
bn08.0054.03	Brown	1960	N08	Adventure Fiction	of	the dimly-outlined , ill-conceived figure of her benighted ancestor	her benighted ancestor	the dimly-outlined , ill-conceived figure	3	5
bn08.0060.01	Brown	1960	N08	Adventure Fiction	of	the direct light of the sun	the sun	the direct light	2	3
bn08.0066.02	Brown	1960	N08	Adventure Fiction	of	the murmuring mouths of the birds	the birds	the murmuring mouths	2	3
bn08.0066.03	Brown	1960	N08	Adventure Fiction	of	the whispered comfort of the trees	the trees	the whispered comfort	2	3
bn08.0069.01	Brown	1960	N08	Adventure Fiction	of	the root of a tree	a tree	the root	2	2
bn08.0076.02	Brown	1960	N08	Adventure Fiction	of	the greedy gloom of the trees	the trees	the greedy gloom	2	3
bn08.0080.01	Brown	1960	N08	Adventure Fiction	of	the cleansing effect of the sun's rays	the sun's rays	the cleansing effect	3	3
bn08.0084.02	Brown	1960	N08	Adventure Fiction	of	the deep confines of the grove	the grove	the deep confines	2	3
bn08.0089.01	Brown	1960	N08	Adventure Fiction	of	the open neck of her blouse	her blouse	the open neck	2	3
bn08.0089.05	Brown	1960	N08	Adventure Fiction	of	all the quivering pores of her skin	her skin	all the quivering pores	2	4
bn08.0092.02	Brown	1960	N08	Adventure Fiction	of	the ghastly intimacy of an incubus	an incubus	the ghastly intimacy	2	3
bn08.0092.10	Brown	1960	N08	Adventure Fiction	of	the roof of her mouth	her mouth	the roof	2	2
bn08.0092.13	Brown	1960	N08	Adventure Fiction	of	the rigid fixture of her jaws	her jaws	the rigid fixture	2	3
bn08.0093.03	Brown	1960	N08	Adventure Fiction	of	the fibers of her brain	her brain	the fibers	2	2
bn08.0095.01	Brown	1960	N08	Adventure Fiction	of	The shadows of the trees	the trees	The shadows	2	2
bn09.0032.01	Brown	1960	N09	Adventure Fiction	of	the front of the car	the car	the front	2	2
bn09.0034.01	Brown	1960	N09	Adventure Fiction	of	the heels of his handmade boots	his handmade boots	the heels	3	2
bn09.0043.01	Brown	1960	N09	Adventure Fiction	of	the westerly end of nowhere	nowhere	the westerly end	1	3
bn09.0076.01	Brown	1960	N09	Adventure Fiction	of	the distant derrick of the wildcat	the wildcat	the distant derrick	2	3
bn09.0094.01	Brown	1960	N09	Adventure Fiction	of	the muscles and nerves of his fine-drawn body	his fine-drawn body	the muscles and nerves	3	4
bn09.0156.01	Brown	1960	N09	Adventure Fiction	of	the lengthening shadow of death	death	the lengthening shadow	1	3
bn09.0157.01	Brown	1960	N09	Adventure Fiction	of	the point of coherent thinking	coherent thinking	the point	2	2
bn09.0160.01	Brown	1960	N09	Adventure Fiction	of	the people of this isolated law-unto-itself world	this isolated law-unto-itself world	the people	4	2
bn09.0167.03	Brown	1960	N09	Adventure Fiction	s	the deputy's deceased father	the deputy's	deceased father	2	2
bn10.0003.02	Brown	1960	N10	Adventure Fiction	of	the first trick of riding night herd	riding night herd	the first trick	3	3
bn10.0007.01	Brown	1960	N10	Adventure Fiction	of	the failure of the boss's wife and son	the boss's wife and son	the failure	5	2
bn10.0007.02	Brown	1960	N10	Adventure Fiction	s	the boss's wife and son	the boss's	wife and son	2	3
bn10.0010.01	Brown	1960	N10	Adventure Fiction	of	the work board of his chuck wagon	his chuck wagon	the work board	3	3
bn10.0042.02	Brown	1960	N10	Adventure Fiction	s	his wife's refusal to come with him	his wife's	refusal to come with him	2	5
bn10.0092.01	Brown	1960	N10	Adventure Fiction	of	the rumble of thunder	thunder	the rumble	1	2
bn10.0105.01	Brown	1960	N10	Adventure Fiction	of	the streets of Rockfork	Rockfork	the streets	1	2
bn10.0118.01	Brown	1960	N10	Adventure Fiction	of	the opposite side of the street	the street	the opposite side	2	3
bn10.0143.01	Brown	1960	N10	Adventure Fiction	s	the lawman's other arm	the lawman's	other arm	2	2
bn10.0152.01	Brown	1960	N10	Adventure Fiction	of	the skirt of Macklin's coat	Macklin's coat	the skirt	2	2
bn10.0175.01	Brown	1960	N10	Adventure Fiction	of	The door of the lockup	the lockup	The door	2	2
bn10.0184.01	Brown	1960	N10	Adventure Fiction	of	the edge of the veranda	the veranda	the edge	2	2
bn10.0193.02	Brown	1960	N10	Adventure Fiction	of	the elegance of that room	that room	the elegance	2	2
bn11.0001.01	Brown	1960	N11	Adventure Fiction	of	The author of the anonymous notes	the anonymous notes	The author	3	2
bn11.0003.01	Brown	1960	N11	Adventure Fiction	of	the day of the deadline	the deadline	the day	2	2
bn11.0007.01	Brown	1960	N11	Adventure Fiction	of	the distant crack of a rifle	a rifle	the distant crack	2	3
bn11.0030.01	Brown	1960	N11	Adventure Fiction	of	the center of William Lewis' chest	William Lewis' chest	the center	3	2
bn11.0036.01	Brown	1960	N11	Adventure Fiction	of	the Bates Hole region of Natrona County	Natrona County	the Bates Hole region	2	4
bn11.0039.02	Brown	1960	N11	Adventure Fiction	of	the day of the killing	the killing	the day	2	2
bn11.0049.02	Brown	1960	N11	Adventure Fiction	of	the very sound of his name	his name	the very sound	2	3
bn11.0051.01	Brown	1960	N11	Adventure Fiction	of	the death of William Lewis	William Lewis	the death	2	2
bn11.0053.01	Brown	1960	N11	Adventure Fiction	of	the work of one of his neighbors	one of his neighbors	the work	4	2
bn11.0056.01	Brown	1960	N11	Adventure Fiction	of	the unplowed land of the dead man	the dead man	the unplowed land	3	3
bn11.0062.02	Brown	1960	N11	Adventure Fiction	of	the distant blast of a rifle	a rifle	the distant blast	2	3
bn11.0071.03	Brown	1960	N11	Adventure Fiction	s	the rifleman's hiding place	the rifleman's	hiding place	2	2
bn11.0076.02	Brown	1960	N11	Adventure Fiction	of	the liquor and professional ladies of Cheyenne	Cheyenne	the liquor and professional ladies	1	5
bn11.0104.01	Brown	1960	N11	Adventure Fiction	of	The small half-heartedly tended fields of men who'd spent more time rustling cattle than farming	men who 'd spent more time rustling cattle than farming	The small half-heartedly tended fields	8	5
bn11.0106.03	Brown	1960	N11	Adventure Fiction	of	the men of the new West	the new West	the men	3	2
bn11.0116.01	Brown	1960	N11	Adventure Fiction	of	the personification of the Devil	the Devil	the personification	2	2
bn11.0122.01	Brown	1960	N11	Adventure Fiction	of	The wailing , guitar-strumming minstrels of the cattle kingdom	the cattle kingdom	The wailing , guitar-strumming minstrels	3	5
bn12.0028.01	Brown	1960	N12	Adventure Fiction	s	Curt's visit to the livery stable	Curt's	visit to the livery stable	1	5
bn12.0033.01	Brown	1960	N12	Adventure Fiction	of	the back of the barn	the barn	the back	2	2
bn12.0035.01	Brown	1960	N12	Adventure Fiction	s	Black's front room	Black's	front room	1	2
bn12.0040.01	Brown	1960	N12	Adventure Fiction	of	the scrape of a shod hoof on a plank floor	a shod hoof on a plank floor	the scrape	7	2
bn12.0042.01	Brown	1960	N12	Adventure Fiction	of	the crunch of grain being ground between strong jaws	grain being ground between strong jaws	the crunch	6	2
bn12.0049.01	Brown	1960	N12	Adventure Fiction	of	the side of the stall	the stall	the side	2	2
bn12.0052.02	Brown	1960	N12	Adventure Fiction	of	the side of the stall	the stall	the side	2	2
bn12.0054.01	Brown	1960	N12	Adventure Fiction	s	Jess's smothered curses	Jess's	smothered curses	1	2
bn12.0060.01	Brown	1960	N12	Adventure Fiction	of	the side of the stall	the stall	the side	2	2
bn12.0078.02	Brown	1960	N12	Adventure Fiction	of	the veins of his neck	his neck	the veins	2	2
bn12.0087.02	Brown	1960	N12	Adventure Fiction	of	the trigger of his gun	his gun	the trigger	2	2
bn12.0103.01	Brown	1960	N12	Adventure Fiction	s	Jess's swarthy face	Jess's	swarthy face	1	2
bn12.0104.01	Brown	1960	N12	Adventure Fiction	of	The fingers of his right hand	his right hand	The fingers	3	2
bn12.0121.01	Brown	1960	N12	Adventure Fiction	s	Jess's coarse features	Jess's	coarse features	1	2
bn12.0123.01	Brown	1960	N12	Adventure Fiction	s	the man's flailing fist	the man's	flailing fist	2	2
bn12.0130.01	Brown	1960	N12	Adventure Fiction	of	the tines of the fork	the fork	the tines	2	2
bn12.0140.01	Brown	1960	N12	Adventure Fiction	s	Black's old crowbait	Black's	old crowbait	1	2
bn12.0156.02	Brown	1960	N12	Adventure Fiction	s	the buckskin's halter rope	the buckskin's	halter rope	2	2
bn13.0001.02	Brown	1960	N13	Adventure Fiction	s	Max's loose grin	Max's	loose grin	1	2
bn13.0001.03	Brown	1960	N13	Adventure Fiction	s	the Burnsides' glowering faces	the Burnsides'	glowering faces	2	2
bn13.0030.02	Brown	1960	N13	Adventure Fiction	s	Nate's purpling forehead	Nate's	purpling forehead	1	2
bn13.0038.01	Brown	1960	N13	Adventure Fiction	of	the foot of Emigrant Rock	Emigrant Rock	the foot	2	2
bn13.0039.02	Brown	1960	N13	Adventure Fiction	of	the opposite side of the wagon	the wagon	the opposite side	2	3
bn13.0049.01	Brown	1960	N13	Adventure Fiction	of	the routines of the day	the day	the routines	2	2
bn13.0058.04	Brown	1960	N13	Adventure Fiction	of	all the fervor and abandon of a real celebration	a real celebration	all the fervor and abandon	3	5
bn13.0068.02	Brown	1960	N13	Adventure Fiction	of	the face of the cliff	the cliff	the face	2	2
bn13.0068.03	Brown	1960	N13	Adventure Fiction	of	the edge of the grub box	the grub box	the edge	3	2
bn13.0068.04	Brown	1960	N13	Adventure Fiction	of	the pressure of her swollen body	her swollen body	the pressure	3	2
bn13.0069.01	Brown	1960	N13	Adventure Fiction	of	the midst of a gay , youthful circle	a gay, youthful circle	the midst	4	2
bn13.0070.02	Brown	1960	N13	Adventure Fiction	s	Sally's happy face and carefree expression	Sally's	happy face and carefree expression	1	5
bn13.0070.03	Brown	1960	N13	Adventure Fiction	s	Harmony's dark , brooding eyes	Harmony's	dark , brooding eyes	1	4
bn13.0074.01	Brown	1960	N13	Adventure Fiction	of	the memory of her folks and the lost Conestoga	her folks and the lost Conestoga	the memory	6	2
bn13.0075.01	Brown	1960	N13	Adventure Fiction	of	the center of the circle	the circle	the center	2	2
bn13.0078.02	Brown	1960	N13	Adventure Fiction	of	the challenging lure of the great cliff towering above them	the great cliff towering above them	the challenging lure	6	3
bn13.0090.02	Brown	1960	N13	Adventure Fiction	of	the arms of her hickory rocker	her hickory rocker	the arms	3	2
bn13.0097.01	Brown	1960	N13	Adventure Fiction	s	Dan's upper lip	Dan's	upper lip	1	2
bn13.0099.05	Brown	1960	N13	Adventure Fiction	of	the front of the wagon	the wagon	the front	2	2
bn13.0105.01	Brown	1960	N13	Adventure Fiction	of	the high face of Emigrant Rock	Emigrant Rock	the high face	2	3
bn13.0114.01	Brown	1960	N13	Adventure Fiction	s	Captain Clemens' signal shot	Captain Clemens'	signal shot	2	2
bn13.0114.01	Brown	1960	N13	Adventure Fiction	s	Captain Clemens' signal shot	Captain Clemens'	signal shot	2	2
bn13.0114.01	Brown	1960	N13	Adventure Fiction	s	Captain Clemens' signal shot	Captain Clemens'	signal shot	2	2
bn13.0114.01	Brown	1960	N13	Adventure Fiction	s	Captain Clemens' signal shot	Captain Clemens'	signal shot	2	2
bn14.0015.03	Brown	1960	N14	Adventure Fiction	of	this side of the street	the street	this side	2	2
bn14.0017.02	Brown	1960	N14	Adventure Fiction	of	the rocky ribs of the canyonside	the canyonside	the rocky ribs	2	3
bn14.0019.01	Brown	1960	N14	Adventure Fiction	of	The front windows of the place	the place	The front windows	2	3
bn14.0041.02	Brown	1960	N14	Adventure Fiction	of	the end of the bar	the bar	the end	2	2
bn14.0042.01	Brown	1960	N14	Adventure Fiction	of	the rear of the place	the place	the rear	2	2
bn14.0075.01	Brown	1960	N14	Adventure Fiction	s	Carmer's ingenious cache for his loot	Carmer's	ingenious cache for his loot	1	5
bn14.0114.02	Brown	1960	N14	Adventure Fiction	of	the mouth of the canyon	the canyon	the mouth	2	2
bn14.0118.03	Brown	1960	N14	Adventure Fiction	s	Chuck Stober's part in recent events	Chuck Stober's	part in recent events	2	4
bn14.0123.01	Brown	1960	N14	Adventure Fiction	of	the distant crack of a gun	a gun	the distant crack	2	3
bn14.0127.01	Brown	1960	N14	Adventure Fiction	of	the direction of the Antler ranch house	the Antler ranch house	the direction	4	2
bn14.0133.01	Brown	1960	N14	Adventure Fiction	of	the fresh clap of guns	guns	the fresh clap	1	3
bn14.0147.02	Brown	1960	N14	Adventure Fiction	of	the level of the surrounding range	the surrounding range	the level	3	2
bn14.0157.02	Brown	1960	N14	Adventure Fiction	of	the side of the winding draw	the winding draw	the side	3	2
bn15.0004.01	Brown	1960	N15	Adventure Fiction	of	the north coast of Mindanao	Mindanao	the north coast	1	3
bn15.0007.02	Brown	1960	N15	Adventure Fiction	of	the east coast of Leyte	Leyte	the east coast	1	3
bn15.0013.01	Brown	1960	N15	Adventure Fiction	of	this muddy wet dark world of combat	combat	this muddy wet dark world	1	5
bn15.0019.01	Brown	1960	N15	Adventure Fiction	of	the straps of the Seton harness	the Seton harness	the straps	3	2
bn15.0031.01	Brown	1960	N15	Adventure Fiction	of	the seven members of his flight	his flight	the seven members	2	3
bn15.0034.01	Brown	1960	N15	Adventure Fiction	of	the clean roar of the engine that took him off the rough strip	the engine that took him off the rough strip	the clean roar	8	3
bn15.0034.02	Brown	1960	N15	Adventure Fiction	of	the skill of Donovan	Donovan	the skill	1	2
bn15.0036.01	Brown	1960	N15	Adventure Fiction	of	the dark green hills of Leyte	Leyte	the dark green hills	1	4
bn15.0040.01	Brown	1960	N15	Adventure Fiction	s	the fighter pilot's horror of bad weather and instrument flying	the fighter pilot's	horror of bad weather and instrument flying	3	7
bn15.0064.02	Brown	1960	N15	Adventure Fiction	of	the sounds of enemy contacts made by other flights	enemy contacts made by other flights	the sounds	6	2
bn15.0065.01	Brown	1960	N15	Adventure Fiction	of	the somewhat hysterical voice of Fleischman	Fleischman	the somewhat hysterical voice	1	4
bn15.0107.01	Brown	1960	N15	Adventure Fiction	s	Greg's airspeed indicator	Greg's	airspeed indicator	1	2
bn15.0143.01	Brown	1960	N15	Adventure Fiction	of	the corner of his eye	his eye	the corner	2	2
