Token	Corpus	Time	Text	Genre	Type	Whole_Genitive	Possessor	Possessum	Possessor_Length	Possessum_Length
fG26.002.02278	Frown	1990	G26	Non-fiction	of	the mouths of her gulls	her gulls	the mouths	2	2
fG26.002.02292	Frown	1990	G26	Non-fiction	of	the extreme verge of gentility	gentility	the extreme verge	1	3
fG26.013.02236	Frown	1990	G26	Non-fiction	of	the myth of its ancient beginnings	its ancient beginnings	the myth	3	2
fG26.013.02236	Frown	1990	G26	Non-fiction	of	the possibility of deliverance	deliverance	the possibility	1	2
fG26.013.02236	Frown	1990	G26	Non-fiction	of	the state of England	England	the state	1	2
fG26.013.02283	Frown	1990	G26	Non-fiction	s	Forster's yearning hope	Forster	yearning hope	1	2
fG26.023.02212	Frown	1990	G26	Non-fiction	of	the most influential event of the twentieth century	the twentieth century	the most influential event	3	4
fG26.023.02212	Frown	1990	G26	Non-fiction	s	Forster's two major novels	Forster	two major novels	1	3
fG26.023.02212	Frown	1990	G26	Non-fiction	of	the onset of all our political woe	all our political woe	the onset	4	2
fG26.032.02213	Frown	1990	G26	Non-fiction	of	the reality of British imperialism	British imperialism	the reality	2	2
fG26.032.02251	Frown	1990	G26	Non-fiction	of	the incomparable beauty of the public surface	the public surface	the incomparable beauty	3	3
fG26.032.02280	Frown	1990	G26	Non-fiction	of	her changes of soil	soil	her changes	1	2
fG26.032.02284	Frown	1990	G26	Non-fiction	s	Forster's invocation of comradeship	Forster	invocation of comradeship	1	3
fG26.032.02284	Frown	1990	G26	Non-fiction	of	the first English disciples of Walt Whitman	Walt Whitman	the first English disciples	2	4
fG26.043.02250	Frown	1990	G26	Non-fiction	of	the end of World War II	World War II	the end	3	2
fG26.053.02268	Frown	1990	G26	Non-fiction	of	different sides of Germany	Germany	different sides	1	2
fG26.053.02268	Frown	1990	G26	Non-fiction	of	the signal points of this novel	this novel	the signal points	2	3
fG26.053.02268	Frown	1990	G26	Non-fiction	s	The Schlegel sisters' German cousin	The Schlegel sisters	German cousin	3	2
fG26.062.02252	Frown	1990	G26	Non-fiction	of	the rancor and frustration of postwar English writing	postwar English writing	the rancor and frustration	3	4
fG26.082.02207	Frown	1990	G26	Non-fiction	s	E.M. Forster's fourth novel	E.M. Forster	fourth novel	2	2
fG26.082.02229	Frown	1990	G26	Non-fiction	s	England's eternal Chinese wall of class distinctions	England	eternal Chinese wall of class distinctions	1	6
fG26.082.02229	Frown	1990	G26	Non-fiction	of	the highest point of its hopes	its hopes	the highest point	2	3
fG26.112.02249	Frown	1990	G26	Non-fiction	of	the plate glass pane of an aquarium	an aquarium	the plate glass pane	2	4
fG35.002.02954	Frown	1990	G35	Non-fiction	of	the spring of 1937	1937	the spring	1	2
fG35.002.02959	Frown	1990	G35	Non-fiction	s	Jean Stafford's own story	Jean Stafford	own story	2	2
fG35.002.02967	Frown	1990	G35	Non-fiction	of	the climax of the high drama	the high drama	the climax	3	2
fG35.002.02967	Frown	1990	G35	Non-fiction	of	the middle of the night	the night	the middle	2	2
fG35.002.02974	Frown	1990	G35	Non-fiction	s	Lowell's wild determination	Lowell	wild determination	1	2
fG35.012.02955	Frown	1990	G35	Non-fiction	of	the civilization of the South	the South	the civilization	2	2
fG35.012.02996	Frown	1990	G35	Non-fiction	of	the spring term of his junior year	his junior year	the spring term	3	3
fG35.032.02988	Frown	1990	G35	Non-fiction	of	the end of their relationship	their relationship	the end	2	2
fG35.042.02973	Frown	1990	G35	Non-fiction	of	the victim of his violent zeal	his violent zeal	the victim	3	2
fG35.042.02999	Frown	1990	G35	Non-fiction	of	the action of my family	my family	the action	2	2
fG35.053.02962	Frown	1990	G35	Non-fiction	of	the civilization of Boston	Boston	the civilization	1	2
fG35.053.03010	Frown	1990	G35	Non-fiction	of	the creative history of this fledgling writer	this fledgling writer	the creative history	3	3
fG35.062.02972	Frown	1990	G35	Non-fiction	s	Cal's romantic history	Cal	romantic history	1	2
fG35.062.03009	Frown	1990	G35	Non-fiction	of	the advice of the readers	the readers	the advice	2	2
fG35.062.03009	Frown	1990	G35	Non-fiction	of	the readers of her first solipsistic venture	her first solipsistic venture	the readers	4	2
fG35.082.02968	Frown	1990	G35	Non-fiction	of	the cause of her delay	her delay	the cause	2	2
fG35.082.03008	Frown	1990	G35	Non-fiction	s	Stafford's ungainly Neville undertaking	Stafford	ungainly Neville undertaking	1	3
fG35.092.02982	Frown	1990	G35	Non-fiction	of	the full articulation of passionate love	passionate love	the full articulation	2	3
fG35.102.02997	Frown	1990	G35	Non-fiction	s	the Lowell's bullying conduct	the Lowell	bullying conduct	2	2
fG39.002.03369	Frown	1990	G39	Non-fiction	of	the cause of the Allies	the Allies	the cause	2	2
fG39.002.03369	Frown	1990	G39	Non-fiction	of	the tyranny of the Hun	the Hun	the tyranny	2	2
fG39.002.03378	Frown	1990	G39	Non-fiction	of	the fall of 1916	1916	the fall	1	2
fG39.002.03381	Frown	1990	G39	Non-fiction	s	Mr. Grundy's local henchmen	Mr. Grundy	local henchmen	2	2
fG39.002.03381	Frown	1990	G39	Non-fiction	of	the middle of town	town	the middle	1	2
fG39.002.03382	Frown	1990	G39	Non-fiction	of	the hands of that pitiful man	that pitiful man	the hands	3	2
fG39.002.03391	Frown	1990	G39	Non-fiction	of	the freedom of political expression	political expression	the freedom	2	2
fG39.002.03391	Frown	1990	G39	Non-fiction	of	the grand spaciousness of that setting	the setting	the grand spaciousness	2	3
fG39.002.03402	Frown	1990	G39	Non-fiction	of	the welfare of the community	the community	the welfare	2	2
fG39.013.03368	Frown	1990	G39	Non-fiction	of	the height of the celebration	the celebration	the height	2	2
fG39.013.03368	Frown	1990	G39	Non-fiction	of	the doorway of the cobbler's shop	the cobbler's shop	the doorway	3	2
fG39.022.03397	Frown	1990	G39	Non-fiction	of	the cantankerous leaders of the Colorado Senate	the Colorado Senate	the cantankerous leaders	3	3
fG39.032.03385	Frown	1990	G39	Non-fiction	of	the virulent anti-Catholicism of the period	the period	the virulent anti-Catholicism	2	3
fG39.042.03386	Frown	1990	G39	Non-fiction	s	the community's leading Republican	the community	leading Republican	2	2
fG39.062.03357	Frown	1990	G39	Non-fiction	of	the autumn of 1917	1917	the autumn	1	2
fG39.062.03357	Frown	1990	G39	Non-fiction	of	the grip of wartime hysteria	wartime hysteria	the grip	2	2
fG39.072.03373	Frown	1990	G39	Non-fiction	of	the lower end of the county	the county	the lower end	2	3
fG39.072.03373	Frown	1990	G39	Non-fiction	of	the hands of the G.O.P.	the G.O.P.	the hands	2	2
fG39.072.03379	Frown	1990	G39	Non-fiction	of	the urgings of Joe Grundy	Joe Grundy	the urgings	2	2
fG39.082.03362	Frown	1990	G39	Non-fiction	of	the set of the jaw	the jaw	the set	2	2
fG39.102.03403	Frown	1990	G39	Non-fiction	of	the wineshops of antiquity	antiquity	the wineshops	1	2
fG39.102.03403	Frown	1990	G39	Non-fiction	of	the informal clubs of California and Texas and Vermont	California and Texas and Vermont	the informal clubs	5	3
fG39.102.03403	Frown	1990	G39	Non-fiction	of	the coffeeshops of England	England	the coffeeshops	1	2
fG39.102.03403	Frown	1990	G39	Non-fiction	of	the Friday-night meeting of the kibbutzim	the kibbitzim	the Friday-night meeting	2	3
fG39.102.03403	Frown	1990	G39	Non-fiction	of	the baths of ancient Rome	ancient Rome	the baths	2	2
fG46.002.03995	Frown	1990	G46	Non-fiction	of	The young American auteurists of the sixties	the sixties	The young American auteurists	2	4
fG46.002.04002	Frown	1990	G46	Non-fiction	s	Hitchcock's own massive efforts	Hitchcock	own massive efforts	1	3
fG46.002.04008	Frown	1990	G46	Non-fiction	s	Hollywood's greatest directors	Hollywood	greatest directors	1	2
fG46.012.03988	Frown	1990	G46	Non-fiction	of	the transformation of his reputation	his reputation	the transformation	2	2
fG46.012.04014	Frown	1990	G46	Non-fiction	s	Hollywood's most successful directors	Hollywood	most successful directors	1	3
fG46.013.04029	Frown	1990	G46	Non-fiction	of	the end of the year	the year	the end	2	2
fG46.022.03980	Frown	1990	G46	Non-fiction	of	the broader significance of the reputational patterns	the reputational patterns	the broader significance	3	3
fG46.022.04038	Frown	1990	G46	Non-fiction	of	the great masters of the cinema	the cinema	the great masters	2	3
fG46.023.03985	Frown	1990	G46	Non-fiction	of	the reputational careers of directors who resemble	directors who resemble	the reputational careers	3	3
fG46.023.03985	Frown	1990	G46	Non-fiction	s	Hitchcock's reputational trajectory	Hitchcock	reputational trajectory	1	2
fG46.023.03985	Frown	1990	G46	Non-fiction	of	the reasonableness of my interpretation	my interpretation	the reasonableness	2	2
fG46.023.03985	Frown	1990	G46	Non-fiction	of	my interpretation of Hitchcock's reputational trajectory	Hitchcock's reputational trajectory	my interpretation	3	2
fG46.023.03997	Frown	1990	G46	Non-fiction	of	the American practitioners of auteur theory	auteur theory	the American practitioners	2	3
fG46.032.03996	Frown	1990	G46	Non-fiction	s	American auteurist Andrew Sarris's most damning category	American auteurist Andrew Sarris	most damning category	4	3
fG46.032.04048	Frown	1990	G46	Non-fiction	of	the works of both Shakespeare and Mozart	both Shakespeare and Mozart	the works	4	2
fG46.033.04053	Frown	1990	G46	Non-fiction	of	the excruciating self-consciousness of most modern artists	most modern artists	the excruciating self-consciousness	3	3
fG46.042.03982	Frown	1990	G46	Non-fiction	of	the logic of experimental design	experimental design	the logic	2	2
fG46.042.03982	Frown	1990	G46	Non-fiction	of	the selection of additional case histories	additional case histories	the selection	3	2
fG46.042.03999	Frown	1990	G46	Non-fiction	s	Hitchcock's British films	Hitchcock	British films	1	2
fG46.052.04005	Frown	1990	G46	Non-fiction	of	the very success of Hitchcock's self&rehy;promotional activities	Hitchcock 's self-promotional activities	the very success	4	3
fG46.052.04005	Frown	1990	G46	Non-fiction	s	Hitchcock's self&rehy;promotional activities	Hitchcock	self-promotional activities	1	2
fG46.052.04012	Frown	1990	G46	Non-fiction	s	Hawks' filmmaking career	Hawks	filmmaking career	1	2
fG46.052.04027	Frown	1990	G46	Non-fiction	of	the summer of 1962	1962	the summer	1	2
fG46.062.04046	Frown	1990	G46	Non-fiction	of	popular hits of the day	the day	popular hits	2	2
fG46.082.04007	Frown	1990	G46	Non-fiction	of	the filmmaking career of Howard Hawks	Howard Hawks	the filmmaking career	2	3
fG46.092.04003	Frown	1990	G46	Non-fiction	of	the artificiality of Hollywood genre films	Hollywood genre films	the artificiality	3	2
fG46.093.04010	Frown	1990	G46	Non-fiction	of	the elements of Hawks' artistry	Hawks' artistry	the elements	2	2
fG46.112.04034	Frown	1990	G46	Non-fiction	of	the power of the individual studios	the individual studios	the power	3	2
fG49.001.04245	Frown	1990	G49	Non-fiction	of	the males of the village	the village	the males	2	2
fG49.002.04248	Frown	1990	G49	Non-fiction	of	the hides of the animals they had killed	the animals they had killed	the hides	5	2
fG49.002.04248	Frown	1990	G49	Non-fiction	of	the end of the three-day hunt	the three-day hunt	the end	3	2
fG49.002.04248	Frown	1990	G49	Non-fiction	of	the proofs of their skill	their skill	the proofs	2	2
fG49.002.04259	Frown	1990	G49	Non-fiction	of	the therapeutic benefit of the hunting competition	the hunting competition	the therapeutic benefit	3	3
fG49.002.04294	Frown	1990	G49	Non-fiction	of	the war chief of the Shawnees	the Shawnees	the war chief	2	3
fG49.002.04300	Frown	1990	G49	Non-fiction	of	the insistence of Chaubenee	Chaubenee	the insistence	1	2
fG49.022.04307	Frown	1990	G49	Non-fiction	of	the Catholic beliefs of his mentors	his mentors	the Catholic beliefs	2	3
fG49.032.04272	Frown	1990	G49	Non-fiction	of	the one-eyed youngest brother of Tecumseh	Tecumseh	the one-eyed youngest brother	1	4
fG49.042.04288	Frown	1990	G49	Non-fiction	of	the principal village of the Shawnees	the Shawnees	the principle village	2	3
fG49.052.04246	Frown	1990	G49	Non-fiction	of	the close of each day	each day	the close	2	2
fG49.052.04295	Frown	1990	G49	Non-fiction	of	the eyes of Shawnee chiefs	Shawnee chiefs	the eyes	2	2
fG49.062.04281	Frown	1990	G49	Non-fiction	of	the daughter of one of the older Peckuwe warriors	one of the older Peckuwe warriors	the daughter	6	2
fG49.072.04251	Frown	1990	G49	Non-fiction	of	the hides of the deer	the deer	the hides	2	2
fG49.072.04264	Frown	1990	G49	Non-fiction	of	the first day of June	June	the first day	1	3
fG49.072.04264	Frown	1990	G49	Non-fiction	of	the territory of the United States	the United States	the territory	3	2
fG49.072.04292	Frown	1990	G49	Non-fiction	of	Chief Five Medals of the St. Joseph River Potawatomies	the St. Joseph River Potawatomies	Chief Five Medals	5	3
fG49.082.04255	Frown	1990	G49	Non-fiction	of	the great prowess of Tecumseh	Tecumseh	the great prowess	1	3
fG49.102.04257	Frown	1990	G49	Non-fiction	of	the reins of leadership	leadership	the reins	1	2
fG52.002.04504	Frown	1990	G52	Non-fiction	s	the latter's large canvas	the latter	large canvas	2	2
fG52.002.04509	Frown	1990	G52	Non-fiction	of	the South of France	France	the South	1	2
fG52.002.04540	Frown	1990	G52	Non-fiction	of	the importance of the projected exhibition	the projected exhibition	the importance	3	2
fG52.012.04550	Frown	1990	G52	Non-fiction	s	Hartley's New Mexico reminiscences	Hartley	New Mexico reminiscences	1	3
fG52.013.04506	Frown	1990	G52	Non-fiction	of	the end of July	July	the end	1	2
fG52.013.04544	Frown	1990	G52	Non-fiction	of	the mass-market quality of that exhibition	that exhibition	the mass-market quality	2	3
fG52.022.04521	Frown	1990	G52	Non-fiction	of	the novelty of its precedent	its precedent	the novelty	2	2
fG52.032.04502	Frown	1990	G52	Non-fiction	of	the life-style of Britain	Britain	the life-style	1	2
fG52.032.04533	Frown	1990	G52	Non-fiction	of	the rolling curves and expanses of his New Mexico reminiscences	his New Mexico reminiscences	the rolling curves and expanses	4	5
fG52.042.04559	Frown	1990	G52	Non-fiction	of	the ornate home of Elinor Glyn	Elinor Glyn	the ornate home	2	3
fG52.042.04566	Frown	1990	G52	Non-fiction	of	the South of France	France	the South	1	2
fG52.062.04519	Frown	1990	G52	Non-fiction	s	the city's busy life	the city	busy life	2	2
fG52.112.04552	Frown	1990	G52	Non-fiction	of	the paintings of Arthur Dove and John Marin	Arthur Dove and John Marin	the paintings	5	2
fG53.001.04569	Frown	1990	G53	Non-fiction	of	the sacrifice of the girl	the girl	the sacrifice	2	2
fG53.002.04599	Frown	1990	G53	Non-fiction	of	the spring of 1926	1926	the spring	1	2
fG53.002.04599	Frown	1990	G53	Non-fiction	of	the old legend plots of Greek tragedy	Greek tragedy	the old legend plots	2	4
fG53.002.04631	Frown	1990	G53	Non-fiction	of	the embattled exterior of the house	the house	the embattled exterior	2	3
fG53.002.04631	Frown	1990	G53	Non-fiction	of	the portraits of the dead Puritan Mannons	the dead Puritan Mannons	the portraits	4	2
fG53.012.04628	Frown	1990	G53	Non-fiction	of	the facade of the house	the house	the facade	2	2
fG53.012.04638	Frown	1990	G53	Non-fiction	of	the New Londoners of O'Neill 's youth	O'Neill 's youth	the New Londoners	3	3
fG53.013.04607	Frown	1990	G53	Non-fiction	of	symbolic motive of sea	sea	symbolic motive	1	2
fG53.013.04625	Frown	1990	G53	Non-fiction	of	the Greek Revival houses of his boyhood	his boyhood	the Greek Revival houses	2	4
fG53.023.04619	Frown	1990	G53	Non-fiction	of	the surfaces of life	life	the surfaces	1	2
fG53.032.04612	Frown	1990	G53	Non-fiction	of	the ships of his play	his play	the ships	2	2
fG53.032.04617	Frown	1990	G53	Non-fiction	of	the name of his tragic family	his tragic family	the name	3	2
fG53.032.04617	Frown	1990	G53	Non-fiction	of	the larger struggle of life-and-death forces	life-and-death forces	the larger struggle	2	3
fG53.032.04617	Frown	1990	G53	Non-fiction	of	the soul of man	man	the soul	1	2
fG53.042.04613	Frown	1990	G53	Non-fiction	of	the heart of this play	this play	the heart	2	2
fG53.053.04621	Frown	1990	G53	Non-fiction	of	the three plays of his trilogy	his trilogy	the three plays	2	3
fG53.063.04635	Frown	1990	G53	Non-fiction	of	the haunted interior of the Mannon house	the Mannon house	the haunted interior	3	3
fG53.072.04616	Frown	1990	G53	Non-fiction	of	five members of his New England family	his New England family	five members	4	2
fG53.072.04629	Frown	1990	G53	Non-fiction	of	the windows of this outraged house	this outraged house	the windows	3	2
fG53.072.04629	Frown	1990	G53	Non-fiction	of	the crimson of the setting sun	the setting sun	the crimson	3	2
fG53.072.04632	Frown	1990	G53	Non-fiction	of	the eyes of the portraits	the portraits	the eyes	2	2
fG53.082.04606	Frown	1990	G53	Non-fiction	of	the brooding rhythm of the sea	the sea	the brooding rhythm	2	3
fG53.082.04623	Frown	1990	G53	Non-fiction	of	the reality of the house	the house	the reality	2	2
fG53.102.04570	Frown	1990	G53	Non-fiction	s	his father's own effort	his father	own effort	2	2
fG53.102.04570	Frown	1990	G53	Non-fiction	of	the sacrifice of Kathleen	Kathleen	the sacrifice	1	2
fG53.112.04610	Frown	1990	G53	Non-fiction	of	the real drama of hidden forces	hidden forces	the real drama	2	3
fG54.002.04723	Frown	1990	G54	Non-fiction	of	the hearts of English	English	the hearts	1	2
fG54.002.04731	Frown	1990	G54	Non-fiction	of	the shoulders of giants	giants	the shoulders	1	2
fG54.002.04741	Frown	1990	G54	Non-fiction	s	Shakespeare's early preeminence	Shakespeare	early preeminence	1	2
fG54.002.04752	Frown	1990	G54	Non-fiction	of	the northern perimeter of London Wall	London Wall	the northern perimeter	2	3
fG54.012.04693	Frown	1990	G54	Non-fiction	of	High Chamberlain of England	England	High Chamberlain	1	2
fG54.012.04733	Frown	1990	G54	Non-fiction	of	the shoulders of the proximate past	the proximate past	the shoulders	3	2
fG54.012.04737	Frown	1990	G54	Non-fiction	of	the tide of times	the times	the tide	2	2
fG54.032.04709	Frown	1990	G54	Non-fiction	of	the master-mistress of his passion	his passion	the master-mistress	2	2
fG54.032.04725	Frown	1990	G54	Non-fiction	of	the subject of a popular jest book	a popular jest book	the subject	4	2
fG54.033.04762	Frown	1990	G54	Non-fiction	s	Marlowe's great triumph	Marlowe	great triumph	1	2
fG54.042.04749	Frown	1990	G54	Non-fiction	of	the end of his career	his career	the end	2	2
fG54.052.04758	Frown	1990	G54	Non-fiction	of	the bank of London Ditch	London Ditch	the bank	2	2
fG54.082.04697	Frown	1990	G54	Non-fiction	s	London's law schools	London	law schools	1	2
fG54.083.04687	Frown	1990	G54	Non-fiction	of	the repertory of a rival company	a rival company	the repertory	3	2
fG54.092.04683	Frown	1990	G54	Non-fiction	s	the time's famous comic	the time	famous comic	2	2
fG54.092.04738	Frown	1990	G54	Non-fiction	of	the sinews of his art	his art	the sinews	2	2
fG54.102.04689	Frown	1990	G54	Non-fiction	of	the spring of 1594	1594	the spring	1	2
fG54.112.04658	Frown	1990	G54	Non-fiction	of	the Irish of their day	their day	the Irish	2	2
fG54.112.04745	Frown	1990	G54	Non-fiction	s	Shakespeare 's early contemporaries	an assassin	early contemporaries	2	2
fG55.002.04783	Frown	1990	G55	Non-fiction	of	the beauty of the scenery	the scenery	the beauty	2	2
fG55.002.04794	Frown	1990	G55	Non-fiction	of	the very embodiment of aristocracy	aristocracy	the very embodiment	1	3
fG55.002.04794	Frown	1990	G55	Non-fiction	of	the sheriff of Hampshire County	Hampshire County	the sheriff	2	2
fG55.002.04794	Frown	1990	G55	Non-fiction	of	the wife of the sheriff of Hampshire County	the sheriff of Hampshire County	the wife	5	2
fG55.002.04817	Frown	1990	G55	Non-fiction	of	the arrival each summer of a number of prominent Southern families	a number of prominent Southern families	the arrival each summer	6	4
fG55.002.04822	Frown	1990	G55	Non-fiction	of	the pious posturings of this man who called himself a Christian	this man who called himself a Christian	the pious posturings	7	3
fG55.002.04825	Frown	1990	G55	Non-fiction	of	the acquaintance of her Southern neighbor	her Southern neighbor	the acquaintance	3	2
fG55.002.04850	Frown	1990	G55	Non-fiction	of	the behavior of Northampton 's Yankee natives	Northampton 's Yankee natives	the behavior	4	2
fG55.002.04850	Frown	1990	G55	Non-fiction	s	Northampton's Yankee natives	Northampton	Yankee natives	1	2
fG55.002.04850	Frown	1990	G55	Non-fiction	of	the intransigence of Southerners	Southerners	the intransigence	1	2
fG55.002.04855	Frown	1990	G55	Non-fiction	of	the attitude of the clergy	the clergy	the attitude	2	2
fG55.002.04858	Frown	1990	G55	Non-fiction	of	the organized antislavery efforts of Hampshire County	Hasmpshire County	the organized antislavery efforts	2	4
fG55.012.04835	Frown	1990	G55	Non-fiction	of	missionary tactics of his own	his own	missionary tactics	2	2
fG55.012.04851	Frown	1990	G55	Non-fiction	of	the owner of the Mansion House	the Mansion House	the owner	3	2
fG55.013.04853	Frown	1990	G55	Non-fiction	of	the principal of the Gothic Seminary for Young Ladies	the Gothic Seminary for Young Ladies	the principal	6	2
fG55.022.04790	Frown	1990	G55	Non-fiction	of	the citizenry of the town	the town	the citizenry	2	2
fG55.022.04818	Frown	1990	G55	Non-fiction	s	Childs' closest neighbor	Childs	closest neighbor	1	2
fG55.022.04827	Frown	1990	G55	Non-fiction	of	the tactics of the abolitionists	the abolitionists	the tactics	2	2
fG55.022.04854	Frown	1990	G55	Non-fiction	of	the end of her first year	her first year	the end	3	2
fG55.023.04785	Frown	1990	G55	Non-fiction	of	the stern Calvinism of their landlord	their landlord	the stern Calvinism	2	3
fG55.023.04808	Frown	1990	G55	Non-fiction	of	the relatives of this family	this family	the relatives	2	2
fG55.023.04808	Frown	1990	G55	Non-fiction	of	the course of her visit	her visit	the course	2	2
fG55.042.04844	Frown	1990	G55	Non-fiction	s	this Yankee woman's sympathetic manner	this Yankee woman	sympathetic manner	3	2
fG55.052.04823	Frown	1990	G55	Non-fiction	s	the Childs' single window	the Childs	single window	2	2
fG55.052.04823	Frown	1990	G55	Non-fiction	of	the south wall of Napier's house	Napier's house	the south wall	2	3
fG55.082.04839	Frown	1990	G55	Non-fiction	of	the evils of slavery	slavery	the evils	1	2
fG55.082.04839	Frown	1990	G55	Non-fiction	of	the happiness of slaves	slaves	the happiness	1	2
fG55.102.04856	Frown	1990	G55	Non-fiction	of	the pastor of the Congregational Church	the Congregational Church	the pastor	3	2
fG55.112.04793	Frown	1990	G55	Non-fiction	of	the favorite of the class	the class	the favorite	2	2
fG55.112.04833	Frown	1990	G55	Non-fiction	of	the brotherhood of the human race	the human race	the brotherhood	3	2
fG57.002.04961	Frown	1990	G57	Non-fiction	of	the success of the American Revolution	the American Revolution	the success	3	2
fG57.002.04991	Frown	1990	G57	Non-fiction	of	the enhanced role of the state	the state	the enhanced role	2	3
fG57.002.04991	Frown	1990	G57	Non-fiction	of	The successful linkage of Protestant values	Protestant values	The successful linkage	2	3
fG57.002.05001	Frown	1990	G57	Non-fiction	of	the destiny of American education	American education	the destiny	2	2
fG57.012.05013	Frown	1990	G57	Non-fiction	of	the goals of public schools	public schools	the goals	2	2
fG57.022.04963	Frown	1990	G57	Non-fiction	of	the ideas of the Enlightenment	the Enlightenment	the ideas	2	2
fG57.022.04963	Frown	1990	G57	Non-fiction	of	the popularity of the ideas of the Enlightenment	the ideas of the Enlightenment	the popularity	5	2
fG57.022.04963	Frown	1990	G57	Non-fiction	of	the power of local ministers	local ministers	the power	2	2
fG57.022.04963	Frown	1990	G57	Non-fiction	of	the values of Yankee traders	Yankee traders	the values	2	2
fG57.022.04989	Frown	1990	G57	Non-fiction	of	the King James version of the Bible	tHe Bible	the King James version	2	4
fG57.022.04993	Frown	1990	G57	Non-fiction	of	strong systems of denominational schools	denominational schools	strong systems	2	2
fG57.022.04998	Frown	1990	G57	Non-fiction	of	the culture of immigrants and Catholics	immigrants and Catholics	the culture	3	2
fG57.022.05000	Frown	1990	G57	Non-fiction	of	the power of majorities	majorities	the power	1	2
fG57.022.05000	Frown	1990	G57	Non-fiction	of	the allegiance of evangelical Protestants	evangelical Protestants	the allegiance	2	2
fG57.022.05018	Frown	1990	G57	Non-fiction	of	public ownership of the means of production	the means of production	public ownership	4	2
fG57.032.04953	Frown	1990	G57	Non-fiction	of	the monopoly of older Latin grammar schools	older Latin grammar schools	the monopoly	4	2
fG57.032.04960	Frown	1990	G57	Non-fiction	of	Great Awakening of the 1730s	the 1730s	Great Awakening	2	2
fG57.032.04960	Frown	1990	G57	Non-fiction	of	the place of religion	religion	the place	1	2
fG57.032.04969	Frown	1990	G57	Non-fiction	of	the assumptions of the Enlightenment	the Enlightenment	the assumptions	2	2
fG57.032.04969	Frown	1990	G57	Non-fiction	s	humanity's inherent nature	humanity	inherent nature	1	2
fG57.032.04969	Frown	1990	G57	Non-fiction	of	the terror of the French Revolution	the French Revolution	the terror	3	2
fG57.032.04976	Frown	1990	G57	Non-fiction	of	The success of interdenominational Protestant groups	interdenominational Protestant groups	the success	3	2
fG57.032.04978	Frown	1990	G57	Non-fiction	of	the children of the unchurched poor	the unchurched poor	the children	3	2
fG57.042.04948	Frown	1990	G57	Non-fiction	s	one's parents and minister	one	parents and minister	1	3
fG57.042.04968	Frown	1990	G57	Non-fiction	of	the rise of faith in human reason	faith in human reason	the rise	4	2
fG57.042.04968	Frown	1990	G57	Non-fiction	of	the perfectibility of humanity	humanity	the perfectibility	1	2
fG57.052.04947	Frown	1990	G57	Non-fiction	of	the Puritans of New England	New England	the Puritans	2	2
fG57.052.04947	Frown	1990	G57	Non-fiction	of	the importance of literacy	literacy	the importance	1	2
